{
  "$schema": "https://rwaresearch.info/data.schema.json",
  "schema_version": "2.0.0",
  "meta": {
    "title": "The State of RWAs – Where the Research Disagrees",
    "site": "https://rwaresearch.info/",
    "author": "Mike Blank",
    "author_url": "https://pl.linkedin.com/in/mishablank",
    "window": {
      "start": "2026-03-29",
      "end": "2026-08-10"
    },
    "reports_read": 63,
    "archived_locally": 50,
    "published": "2026-07-17",
    "updated": "2026-09-26",
    "currency": "USD",
    "value_basis": "Nominal USD as reported by each source; no inflation or FX adjustment.",
    "disclaimer": "Figures are reproduced as reported by each source on the date cited; scopes and definitions differ materially between studies and are not directly comparable.",
    "license": "CC BY 4.0 – cite as \"Mike Blank, rwaresearch.info\"",
    "og_card": {
      "reports_read": 63,
      "fc_lo_usd": 400000000000,
      "fc_hi_usd": 14000000000000,
      "fc_spread": 35,
      "updated": "2026-09"
    }
  },
  "scopes": [
    {
      "id": "narrow",
      "label": "Free-float / distributed only",
      "description": "Only distributed / free-float tokenized assets that trade on-chain; stablecoins excluded."
    },
    {
      "id": "public",
      "label": "Public chains, all issued",
      "description": "Every tokenized asset issued on public blockchains, distributed or not; permissioned networks excluded."
    },
    {
      "id": "secur",
      "label": "Securities & core asset classes",
      "description": "Tokenized securities and core asset classes (equities, Treasuries, commodities, ETFs)."
    },
    {
      "id": "broad",
      "label": "Broad – incl. funds / 12-class core",
      "description": "Broad definitions that add funds or a 12-class core asset list."
    },
    {
      "id": "all",
      "label": "All-in – incl. stablecoins / settlement layer",
      "description": "Everything on-chain including stablecoins and settlement positions."
    }
  ],
  "metrics": [
    {
      "id": "market_size",
      "label": "Tokenized asset market size (a stock of value)",
      "short": "",
      "unit_note": ""
    },
    {
      "id": "fund_aum",
      "label": "Tokenized fund AUM only",
      "short": "funds",
      "unit_note": "Tokenized funds only, not total market size – different unit"
    },
    {
      "id": "revenue",
      "label": "Revenue pool",
      "short": "revenue",
      "unit_note": "Revenue, not market size – different unit"
    },
    {
      "id": "am_opportunity",
      "label": "Opportunity for asset managers",
      "short": "AM",
      "unit_note": "Asset-management opportunity, not market size – different unit"
    },
    {
      "id": "stablecoin_supply",
      "label": "Stablecoin adoption / supply",
      "short": "stablecoin",
      "unit_note": "Stablecoin adoption, not tokenized RWA market size – different unit"
    },
    {
      "id": "settlement_volume",
      "label": "On-chain settlement volume (monthly flow)",
      "short": "monthly volume",
      "unit_note": "A monthly flow, not a stock of assets – different unit"
    }
  ],
  "desk_groups": [
    {
      "id": "banks",
      "label": "Banks"
    },
    {
      "id": "managers",
      "label": "Managers & issuers"
    },
    {
      "id": "consultancies",
      "label": "Consultancies"
    },
    {
      "id": "crypto",
      "label": "Crypto research & trackers"
    },
    {
      "id": "official",
      "label": "Official sector"
    }
  ],
  "desks": [
    {
      "id": "citi",
      "name": "Citi",
      "group": "banks",
      "note": "Citi Institute · Jun 2026"
    },
    {
      "id": "standard-chartered",
      "name": "Standard Chartered",
      "group": "banks",
      "short": "SC",
      "note": "May + Aug 2026"
    },
    {
      "id": "jpmorgan",
      "name": "J.P. Morgan",
      "group": "banks",
      "note": "Payments · Kinexys"
    },
    {
      "id": "morgan-stanley",
      "name": "Morgan Stanley",
      "group": "banks",
      "note": "× Oliver Wyman"
    },
    {
      "id": "deutsche-bank",
      "name": "Deutsche Bank",
      "group": "banks",
      "note": "2026"
    },
    {
      "id": "hsbc",
      "name": "HSBC",
      "group": "banks"
    },
    {
      "id": "barclays",
      "name": "Barclays",
      "group": "banks"
    },
    {
      "id": "nomura",
      "name": "Nomura",
      "group": "banks"
    },
    {
      "id": "securitize-keyrock",
      "name": "Securitize × Keyrock",
      "group": "managers",
      "note": "Apr 2026"
    },
    {
      "id": "21shares",
      "name": "21Shares",
      "group": "managers",
      "note": "Jun 2026"
    },
    {
      "id": "grayscale",
      "name": "Grayscale",
      "group": "managers",
      "note": "Research · Apr 2026"
    },
    {
      "id": "blackrock",
      "name": "BlackRock",
      "group": "managers"
    },
    {
      "id": "franklin-templeton",
      "name": "Franklin Templeton",
      "group": "managers"
    },
    {
      "id": "bitwise",
      "name": "Bitwise",
      "group": "managers"
    },
    {
      "id": "bcg",
      "name": "BCG",
      "group": "consultancies",
      "note": "Global AM Report · Apr 2026"
    },
    {
      "id": "mckinsey",
      "name": "McKinsey",
      "group": "consultancies",
      "note": "2026"
    },
    {
      "id": "pwc",
      "name": "PwC",
      "group": "consultancies",
      "note": "2026"
    },
    {
      "id": "oliver-wyman",
      "name": "Oliver Wyman (standalone)",
      "group": "consultancies"
    },
    {
      "id": "deloitte",
      "name": "Deloitte",
      "group": "consultancies"
    },
    {
      "id": "kpmg",
      "name": "KPMG",
      "group": "consultancies"
    },
    {
      "id": "binance-research",
      "name": "Binance Research",
      "group": "crypto",
      "short": "Binance",
      "note": "May–Jul 2026"
    },
    {
      "id": "pantera",
      "name": "Pantera Capital",
      "group": "crypto",
      "short": "Pantera",
      "note": "May 2026"
    },
    {
      "id": "beincrypto-rwaxyz",
      "name": "BeInCrypto × RWA.xyz",
      "group": "crypto",
      "short": "BeInCrypto",
      "note": "Apr–Jun 2026"
    },
    {
      "id": "defillama",
      "name": "DefiLlama",
      "group": "crypto",
      "note": "Apr 2026"
    },
    {
      "id": "coingecko",
      "name": "CoinGecko",
      "group": "crypto",
      "note": "Q1 2026"
    },
    {
      "id": "messari",
      "name": "Messari",
      "group": "crypto"
    },
    {
      "id": "galaxy",
      "name": "Galaxy",
      "group": "crypto"
    },
    {
      "id": "bis",
      "name": "BIS",
      "group": "official",
      "note": "Annual Economic Report 2026, Ch. III"
    },
    {
      "id": "imf",
      "name": "IMF",
      "group": "official",
      "note": "Tokenized Finance · 2026"
    },
    {
      "id": "gfma",
      "name": "GFMA",
      "group": "official",
      "note": "2026"
    },
    {
      "id": "omfif",
      "name": "OMFIF",
      "group": "official"
    }
  ],
  "sources": [
    {
      "id": "citi-2030",
      "desk": "citi",
      "publisher": "Citi (Citi Institute)",
      "title": "Tokenization 2030: Wall Street On-Chain",
      "published": "2026-06",
      "url": "https://www.citigroup.com/global/insights/tokenization-2030"
    },
    {
      "id": "sc-tokenization-defi",
      "desk": "standard-chartered",
      "publisher": "Standard Chartered",
      "title": "Digital-assets research – ~$4T tokenized by 2028",
      "published": "2026-05-26",
      "url": "https://www.theblock.co/post/401635/standard-chartered-projects-4t-in-tokenized-assets-by-end-2028-with-defi-protocols-primary-beneficiaries",
      "access": "client-only"
    },
    {
      "id": "sc-owning-rails",
      "desk": "standard-chartered",
      "publisher": "Standard Chartered",
      "title": "Chainlink: Owning the rails",
      "published": "2026-08-10",
      "url": "https://www.theblock.co/news/defi/2026-08-10-standard-chartered-chainlink-tokenization-411252",
      "access": "client-only"
    },
    {
      "id": "sc-nonusd-stablecoins",
      "desk": "standard-chartered",
      "publisher": "Standard Chartered × Zodia Markets",
      "title": "Beyond Concentration: Where Non-USD Stablecoins Can Scale",
      "published": "2026-04",
      "url": "https://www.sc.com/en/uploads/sites/66/content/docs/where-local-currency-stablecoins-can-scale-report-sc.pdf"
    },
    {
      "id": "jpm-payments-outlook",
      "desk": "jpmorgan",
      "publisher": "J.P. Morgan",
      "title": "Payments Outlook 2026: Five Shifts Powering Payments",
      "published": "2026-04",
      "url": "https://www.jpmorgan.com/insights/payments/trends-innovation/payments-outlook-trends-2026"
    },
    {
      "id": "msow-digital-rails",
      "desk": "morgan-stanley",
      "publisher": "Morgan Stanley × Oliver Wyman",
      "title": "Digital Rails, Real Economics: Digital Assets and the Future of Wholesale Banking",
      "published": "2026-05",
      "url": "https://www.oliverwyman.com/our-expertise/insights/2026/may/digital-assets-future-wholesale-banking.html"
    },
    {
      "id": "db-digital-money",
      "desk": "deutsche-bank",
      "publisher": "Deutsche Bank",
      "title": "Digital Money: a perspective on stablecoins, tokenised deposits and CBDCs",
      "published": "2026-05",
      "url": "https://flow.db.com/publications/flow-white-papers-and-guides/digital-money-a-perspective-on-stablecoins-tokenised-deposits-and-cbdcs"
    },
    {
      "id": "securitize-keyrock-400t",
      "desk": "securitize-keyrock",
      "publisher": "Securitize × Keyrock",
      "title": "The $400T Future of Tokenised Assets",
      "published": "2026-04",
      "url": "https://keyrock.com/the-400t-future-of-tokenised-assets/"
    },
    {
      "id": "21shares-midyear",
      "desk": "21shares",
      "publisher": "21Shares",
      "title": "State of Crypto – Market Outlook 2026, Mid-Year Update",